{
  "id": "phonics-find-b-ball",
  "version": 1,
  "title": "Find More /b/ Sounds",
  "domain": "phonics",
  "skill_ids": ["initial_sound", "letter_sound_match"],
  "transfer": {
    "skill_ids": ["initial_sound", "letter_sound_match"],
    "context_type": "same_format_new_examples",
    "context_id": "tap-picture-initial-sound",
    "example_set_id": "ball-fish-dog",
    "prompt_mode": "spoken"
  },
  "difficulty": {
    "level": 2,
    "choice_count": 3,
    "distractor_strength": "easy"
  },
  "interaction_model": "tap_to_match",
  "estimated_duration_seconds": 60,
  "content": {
    "prompt_audio": "Find the word that starts with the letter B.",
    "target_sound": "b",
    "choices": [
      {
        "id": "ball",
        "label": "ball",
        "image": "/assets/images/ball.svg",
        "correct": true
      },
      {
        "id": "fish",
        "label": "fish",
        "image": "/assets/images/fish.svg",
        "correct": false
      },
      {
        "id": "dog",
        "label": "dog",
        "image": "/assets/images/dog.svg",
        "correct": false
      }
    ]
  },
  "success_rules": {
    "correct_choice_id": "ball",
    "required_correct_count": 1,
    "max_attempts_before_hint": 2
  },
  "feedback_rules": {
    "correct": {
      "speech": "Ball starts with b!",
      "animation": "glow_pop",
      "sound": "soft_chime"
    },
    "incorrect": {
      "speech": "Try again. Listen for b.",
      "animation": "gentle_bounce",
      "sound": "soft_boing"
    },
    "hint": {
      "speech": "Buh, buh, ball.",
      "highlight_target": true
    }
  },
  "safety": {
    "requires_parent_approval": true,
    "external_links_allowed": false,
    "contains_video": false,
    "contains_audio": true
  }
}
