{
  "id": "blend-cat",
  "version": 1,
  "title": "Blend the Sounds: cat",
  "domain": "phonics",
  "skill_ids": ["blending"],
  "transfer": {
    "skill_ids": ["blending"],
    "context_type": "same_format_same_examples",
    "context_id": "tap-picture-blend",
    "example_set_id": "cat-bat-hat",
    "prompt_mode": "spoken"
  },
  "difficulty": {
    "level": 2,
    "choice_count": 3,
    "distractor_strength": "hard"
  },
  "interaction_model": "tap_to_match",
  "estimated_duration_seconds": 60,
  "content": {
    "prompt_audio": "Sound it out. Which word do these sounds make?",
    "segments": ["c", "a", "t"],
    "target_word": "cat",
    "next_activity_id": "blend-hat",
    "next_label": "Next word",
    "choices": [
      { "id": "cat", "label": "cat", "image": "/assets/images/cat.svg", "correct": true },
      { "id": "bat", "label": "bat", "image": "/assets/images/bat.svg", "correct": false },
      { "id": "hat", "label": "hat", "image": "/assets/images/hat.svg", "correct": false }
    ]
  },
  "success_rules": {
    "correct_choice_id": "cat",
    "required_correct_count": 1,
    "max_attempts_before_hint": 2
  },
  "feedback_rules": {
    "correct": { "speech": "c-a-t. Cat!", "animation": "glow_pop", "sound": "soft_chime" },
    "incorrect": { "speech": "Listen again. c-a-t.", "animation": "gentle_bounce", "sound": "soft_boing" },
    "hint": { "speech": "c ... a ... t. Cat.", "highlight_target": true }
  },
  "safety": {
    "requires_parent_approval": true,
    "external_links_allowed": false,
    "contains_video": false,
    "contains_audio": true
  }
}
