{
  "id": "phonics-find-b",
  "version": 1,
  "title": "Find the /b/ Sound",
  "domain": "phonics",
  "skill_ids": ["initial_sound", "letter_sound_match"],
  "transfer": {
    "skill_ids": ["initial_sound", "letter_sound_match"],
    "context_type": "same_format_same_examples",
    "context_id": "tap-picture-initial-sound",
    "example_set_id": "bear-cat-sun",
    "prompt_mode": "spoken"
  },
  "difficulty": {
    "level": 2,
    "choice_count": 3,
    "distractor_strength": "easy"
  },
  "interaction_model": "tap_to_match",
  "estimated_duration_seconds": 60,
  "content": {
    "prompt_audio": "Find the word that starts with b.",
    "target_sound": "b",
    "next_activity_id": "phonics-find-m",
    "next_label": "Next word",
    "choices": [
      {
        "id": "bear",
        "label": "bear",
        "image": "/assets/images/bear.svg",
        "correct": true
      },
      {
        "id": "cat",
        "label": "cat",
        "image": "/assets/images/cat.svg",
        "correct": false
      },
      {
        "id": "sun",
        "label": "sun",
        "image": "/assets/images/sun.svg",
        "correct": false
      }
    ]
  },
  "success_rules": {
    "correct_choice_id": "bear",
    "required_correct_count": 1,
    "max_attempts_before_hint": 2
  },
  "feedback_rules": {
    "correct": {
      "speech": "Bear starts with b!",
      "animation": "glow_pop",
      "sound": "soft_chime"
    },
    "incorrect": {
      "speech": "Try again. Listen for b.",
      "animation": "gentle_bounce",
      "sound": "soft_boing"
    },
    "hint": {
      "speech": "Buh, buh, bear.",
      "highlight_target": true
    }
  },
  "safety": {
    "requires_parent_approval": true,
    "external_links_allowed": false,
    "contains_video": false,
    "contains_audio": true
  }
}
