{
  "id": "math-count-hearts-three",
  "version": 1,
  "title": "Count the Hearts",
  "domain": "math",
  "skill_ids": ["counting", "subitizing"],
  "transfer": {
    "skill_ids": ["counting", "subitizing"],
    "context_type": "same_format_new_examples",
    "context_id": "tap-quantity-choice",
    "example_set_id": "three-hearts-line",
    "prompt_mode": "mixed"
  },
  "difficulty": {
    "level": 1,
    "choice_count": 3,
    "distractor_strength": "easy"
  },
  "interaction_model": "tap_to_match",
  "estimated_duration_seconds": 45,
  "content": {
    "prompt_audio": "How many hearts do you see?",
    "prompt_images": [
      "/assets/images/heart.svg",
      "/assets/images/heart.svg",
      "/assets/images/heart.svg"
    ],
    "choices": [
      {
        "id": "two",
        "label": "2",
        "correct": false
      },
      {
        "id": "three",
        "label": "3",
        "correct": true
      },
      {
        "id": "four",
        "label": "4",
        "correct": false
      }
    ]
  },
  "success_rules": {
    "correct_choice_id": "three",
    "required_correct_count": 1,
    "max_attempts_before_hint": 2
  },
  "feedback_rules": {
    "correct": {
      "speech": "Yes. Three hearts.",
      "animation": "glow_pop",
      "sound": "soft_chime"
    },
    "incorrect": {
      "speech": "Count each heart and try again.",
      "animation": "gentle_bounce",
      "sound": "soft_boing"
    },
    "hint": {
      "speech": "One, two, three hearts.",
      "highlight_target": true
    }
  },
  "safety": {
    "requires_parent_approval": true,
    "external_links_allowed": false,
    "contains_video": false,
    "contains_audio": true
  }
}
