{
  "id": "phonics-find-c",
  "version": 1,
  "title": "Find the /c/ Sound",
  "domain": "phonics",
  "skill_ids": ["initial_sound", "letter_sound_match"],
  "transfer": {
    "skill_ids": ["initial_sound", "letter_sound_match"],
    "context_type": "same_format_new_examples",
    "context_id": "tap-picture-initial-sound",
    "example_set_id": "cat-sun-fish",
    "prompt_mode": "spoken"
  },
  "difficulty": { "level": 2, "choice_count": 3, "distractor_strength": "easy" },
  "interaction_model": "tap_to_match",
  "estimated_duration_seconds": 60,
  "content": {
    "prompt_audio": "Find the word that starts with c.",
    "target_sound": "c",
    "next_activity_id": "phonics-find-t",
    "next_label": "Next word",
    "choices": [
      { "id": "cat", "label": "cat", "image": "/assets/images/cat.svg", "correct": true },
      { "id": "sun", "label": "sun", "image": "/assets/images/sun.svg", "correct": false },
      { "id": "fish", "label": "fish", "image": "/assets/images/fish.svg", "correct": false }
    ]
  },
  "success_rules": { "correct_choice_id": "cat", "required_correct_count": 1, "max_attempts_before_hint": 2 },
  "feedback_rules": {
    "correct": { "speech": "Cat starts with c!", "animation": "glow_pop", "sound": "soft_chime" },
    "incorrect": { "speech": "Try again. Listen for c.", "animation": "gentle_bounce", "sound": "soft_boing" },
    "hint": { "speech": "Kuh, kuh, cat.", "highlight_target": true }
  },
  "safety": { "requires_parent_approval": true, "external_links_allowed": false, "contains_video": false, "contains_audio": true }
}
